{
 "schema": 1,
 "asOf": "2026-10-04T11:17:35+03:00",
 "asOfBy": {
  "BIST": "2026-10-04T11:17:35+03:00",
  "US": "2026-10-04T11:17:35+03:00"
 },
 "source": "TradingView ve Yahoo Finance",
 "period": {
  "BIST": "2026/6",
  "US": "2026/6"
 },
 "industries": {
  "food_beverage": {
   "tr": "Gıda-içecek",
   "en": "Food & beverage",
   "cyclical": false
  },
  "defense": {
   "tr": "Savunma",
   "en": "Defense",
   "cyclical": false
  },
  "electrical_equipment": {
   "tr": "Elektrik ekipmanı",
   "en": "Electrical equipment",
   "cyclical": false
  },
  "retail": {
   "tr": "Perakende",
   "en": "Retail",
   "cyclical": false
  },
  "real_estate": {
   "tr": "Gayrimenkul",
   "en": "Real estate",
   "cyclical": false
  },
  "construction": {
   "tr": "İnşaat ve mühendislik",
   "en": "Construction & engineering",
   "cyclical": false
  },
  "steel": {
   "tr": "Demir-çelik",
   "en": "Steel",
   "cyclical": true
  },
  "automotive": {
   "tr": "Otomotiv",
   "en": "Automotive",
   "cyclical": false
  },
  "fertilizers": {
   "tr": "Gübre-kimya",
   "en": "Fertilizers & chemicals",
   "cyclical": false
  },
  "holding": {
   "tr": "Holding",
   "en": "Holding company",
   "cyclical": false
  },
  "petrochemicals": {
   "tr": "Petrokimya",
   "en": "Petrochemicals",
   "cyclical": true
  },
  "airlines": {
   "tr": "Havayolu",
   "en": "Airlines",
   "cyclical": true
  },
  "chemicals_textile": {
   "tr": "Kimya-tekstil",
   "en": "Chemicals & textiles",
   "cyclical": true
  },
  "glass": {
   "tr": "Cam-kimya",
   "en": "Glass & chemicals",
   "cyclical": false
  },
  "airports": {
   "tr": "Havalimanı",
   "en": "Airport operator",
   "cyclical": false
  },
  "telecom": {
   "tr": "Telekom",
   "en": "Telecom",
   "cyclical": false
  },
  "gold_mining": {
   "tr": "Altın madenciliği",
   "en": "Gold mining",
   "cyclical": true
  },
  "metal_mining": {
   "tr": "Metal madenciliği",
   "en": "Metals & mining",
   "cyclical": true
  },
  "refining": {
   "tr": "Rafineri",
   "en": "Oil refining",
   "cyclical": true
  },
  "semiconductors": {
   "tr": "Yarı iletken",
   "en": "Semiconductors",
   "cyclical": true
  },
  "software": {
   "tr": "Yazılım",
   "en": "Software",
   "cyclical": false
  },
  "internet": {
   "tr": "İnternet ve e-ticaret",
   "en": "Internet & e-commerce",
   "cyclical": false
  },
  "consumer_electronics": {
   "tr": "Tüketici elektroniği ve donanım",
   "en": "Consumer electronics & hardware",
   "cyclical": false
  },
  "pharmaceuticals": {
   "tr": "İlaç",
   "en": "Pharmaceuticals",
   "cyclical": false
  },
  "banks": {
   "tr": "Banka",
   "en": "Banks",
   "cyclical": false
  }
 },
 "stocks": [
  {
   "k": "AEFES",
   "ad": "Anadolu Efes",
   "market": "BIST",
   "cur": "TRY",
   "ind": "food_beverage",
   "f": 18.04,
   "fk": 10.95,
   "pd": 0.85,
   "fdf": 6.2,
   "peg": null,
   "nb": 1.36,
   "mv": 106.8,
   "fg": 42,
   "ng": -10,
   "h": 27.64,
   "sma20": 18.78,
   "sma50": 19.45,
   "sma200": 19.12,
   "not": "FAVÖK %26 artarken net kâr %7 gerilemiş; fark faaliyet dışı kalemlerden geliyor.",
   "notAsOf": "2026-10-02"
  },
  {
   "k": "ASELS",
   "ad": "Aselsan",
   "market": "BIST",
   "cur": "TRY",
   "ind": "defense",
   "f": 362.75,
   "fk": 44.57,
   "pd": 5.39,
   "fdf": 30.2,
   "peg": 0.4,
   "nb": 0.6,
   "mv": 1654.1,
   "fg": 61,
   "ng": 113,
   "h": 481.26,
   "sma20": 374.4,
   "sma50": 375.5,
   "sma200": 352.31,
   "not": "Güçlü büyüme beklentisi fiyata yansımış. PEG makul ama F/K endeksin çok üzerinde.",
   "notAsOf": "2026-10-02"
  },
  {
   "k": "ASTOR",
   "ad": "Astor Enerji",
   "market": "BIST",
   "cur": "TRY",
   "ind": "electrical_equipment",
   "f": 220,
   "fk": 21.58,
   "pd": 5.01,
   "fdf": 15.98,
   "peg": 0.24,
   "nb": -0.72,
   "mv": 219.6,
   "fg": 71,
   "ng": 87,
   "h": 433.34,
   "sma20": 257.97,
   "sma50": 293.31,
   "sma200": 243.7,
   "not": "Net kâr artışı FAVÖK artışının çok üzerinde; net parasal kaybın azalması kârı yukarı itmiş.",
   "notAsOf": "2026-10-02"
  },
  {
   "k": "BIMAS",
   "ad": "BİM",
   "market": "BIST",
   "cur": "TRY",
   "ind": "retail",
   "f": 414,
   "fk": 18.11,
   "pd": 2.44,
   "fdf": 10.21,
   "peg": 0.2,
   "nb": 0.63,
   "mv": 490.9,
   "fg": 84,
   "ng": 87,
   "h": 519.45,
   "sma20": 422.64,
   "sma50": 407.08,
   "sma200": 366.52,
   "not": "Faaliyetler büyüyor; net kâr artışının bir kısmı net parasal pozisyon kazancından (+%32).",
   "notAsOf": "2026-10-02"
  },
  {
   "k": "EKGYO",
   "ad": "Emlak Konut GYO",
   "market": "BIST",
   "cur": "TRY",
   "ind": "real_estate",
   "f": 19.07,
   "fk": null,
   "pd": 0.45,
   "fdf": 5.46,
   "peg": null,
   "nb": 2.33,
   "mv": 69.8,
   "fg": 5,
   "ng": null,
   "ngT": "kârdan zarara",
   "loss": true,
   "h": 32.84,
   "sma20": 19.65,
   "sma50": 19.25,
   "sma200": 20.82,
   "not": "Son 12 ayda zarar. GYO'larda PD/DD ve proje stoğu öne çıkar.",
   "notAsOf": "2026-10-02"
  },
  {
   "k": "ENKAI",
   "ad": "Enka İnşaat",
   "market": "BIST",
   "cur": "TRY",
   "ind": "construction",
   "f": 84,
   "fk": 12.62,
   "pd": 1.23,
   "fdf": 9.7,
   "peg": 0.37,
   "nb": -5.12,
   "mv": 492.4,
   "fg": 14,
   "ng": 34,
   "h": 116.3,
   "sma20": 86.59,
   "sma50": 86.25,
   "sma200": 92.03,
   "usd": "USD",
   "not": "FAVÖK gerilerken net kâr artmış; fark faaliyet dışı gelirlerden. Güçlü net nakit pozisyonu var.",
   "notAsOf": "2026-10-02"
  },
  {
   "k": "EREGL",
   "ad": "Ereğli Demir Çelik",
   "market": "BIST",
   "cur": "TRY",
   "ind": "steel",
   "f": 37.02,
   "fk": 32.27,
   "pd": 0.78,
   "fdf": 12.16,
   "peg": 0.67,
   "nb": 1.58,
   "mv": 255.1,
   "fg": 49,
   "ng": 48,
   "h": 43.99,
   "sma20": 37.67,
   "sma50": 38.61,
   "sma200": 34.39,
   "usd": "USD",
   "not": "Kâr düşük bir bazdan toparlanıyor; çelik fiyatlarına bağlı döngüsel iş.",
   "notAsOf": "2026-10-02"
  },
  {
   "k": "FROTO",
   "ad": "Ford Otosan",
   "market": "BIST",
   "cur": "TRY",
   "ind": "automotive",
   "f": 74.15,
   "fk": 8.68,
   "pd": 1.45,
   "fdf": 7.9,
   "peg": null,
   "nb": 2.38,
   "mv": 260.2,
   "fg": 11,
   "ng": -13,
   "h": 139.88,
   "sma20": 78.08,
   "sma50": 78.35,
   "sma200": 94.04,
   "not": "Satış, FAVÖK ve net kâr birlikte gerilemiş. Düşük F/K bu yüzden ucuzluk anlamına gelmeyebilir.",
   "notAsOf": "2026-10-02"
  },
  {
   "k": "GUBRF",
   "ad": "Gübre Fabrikaları",
   "market": "BIST",
   "cur": "TRY",
   "ind": "fertilizers",
   "f": 419.75,
   "fk": 18.2,
   "pd": 3.54,
   "fdf": 10.12,
   "peg": 0.33,
   "nb": -0.38,
   "mv": 140.2,
   "fg": 64,
   "ng": 54,
   "h": null,
   "sma20": 453.34,
   "sma50": 449.57,
   "sma200": 474.4,
   "not": "Satış, FAVÖK ve esas faaliyet kârı aynı hızda (%22-23) büyüyor; net nakit pozisyonunda. Analist kapsamı yok.",
   "notAsOf": "2026-10-02"
  },
  {
   "k": "KCHOL",
   "ad": "Koç Holding",
   "market": "BIST",
   "cur": "TRY",
   "ind": "holding",
   "f": 206.8,
   "fk": 14.74,
   "pd": 0.66,
   "fdf": 6.76,
   "peg": 0.03,
   "nb": 2.71,
   "mv": 524.4,
   "fg": 94,
   "ng": 508,
   "h": 327.5,
   "sma20": 217.62,
   "sma50": 211.25,
   "sma200": 199.65,
   "not": "Holding: değeri iştiraklerin toplamıdır ve net aktif değer iskontosuyla değerlendirilir. Konsolide borç, finans iştiraklerini de içerdiği için yüksek görünür.",
   "notAsOf": "2026-10-02"
  },
  {
   "k": "KRDMD",
   "ad": "Kardemir",
   "market": "BIST",
   "cur": "TRY",
   "ind": "steel",
   "f": 43.28,
   "fk": 10.8,
   "pd": 0.46,
   "fdf": 5.56,
   "peg": null,
   "nb": 0.04,
   "mv": 47.6,
   "fg": 117,
   "ng": null,
   "ngT": "zarardan kâra",
   "h": 44,
   "sma20": 45.17,
   "sma50": 43.99,
   "sma200": 36.82,
   "not": "Geçen yıl aynı dönemde zarar, bu yıl kâr; büyüme oranı anlamlı hesaplanamaz.",
   "notAsOf": "2026-10-02"
  },
  {
   "k": "MGROS",
   "ad": "Migros",
   "market": "BIST",
   "cur": "TRY",
   "ind": "retail",
   "f": 515,
   "fk": 15.43,
   "pd": 0.99,
   "fdf": 12.14,
   "peg": 1.77,
   "nb": 0.79,
   "mv": 91.7,
   "fg": 173,
   "ng": 8,
   "h": 900,
   "sma20": 526.33,
   "sma50": 560.99,
   "sma200": 617.08,
   "not": "Esas faaliyet zararda; kâr büyük ölçüde net parasal pozisyon kazancından.",
   "notAsOf": "2026-10-02"
  },
  {
   "k": "PETKM",
   "ad": "Petkim",
   "market": "BIST",
   "cur": "TRY",
   "ind": "petrochemicals",
   "f": 19.55,
   "fk": null,
   "pd": 0.66,
   "fdf": 883.09,
   "peg": null,
   "nb": 439.53,
   "mv": 49.5,
   "fg": null,
   "ng": null,
   "fgT": "eksiden artıya",
   "loss": true,
   "h": 20.66,
   "sma20": 21.89,
   "sma50": 20.57,
   "sma200": 20.14,
   "not": "Son 12 ayda zarar. FAVÖK çok düşük olduğu için borç oranı aşırı yüksek görünüyor.",
   "notAsOf": "2026-10-02"
  },
  {
   "k": "PGSUS",
   "ad": "Pegasus",
   "market": "BIST",
   "cur": "TRY",
   "ind": "airlines",
   "f": 141.6,
   "fk": null,
   "pd": 0.63,
   "fdf": 8.68,
   "peg": null,
   "nb": 6.28,
   "mv": 70.8,
   "fg": -14,
   "ng": null,
   "ngT": "kârdan zarara",
   "loss": true,
   "h": 229.11,
   "sma20": 148.31,
   "sma50": 150.59,
   "sma200": 177.17,
   "usd": "EUR",
   "not": "Son dönemde zarara geçmiş; uçak finansmanı kaynaklı yüksek borç.",
   "notAsOf": "2026-10-02"
  },
  {
   "k": "SAHOL",
   "ad": "Sabancı Holding",
   "market": "BIST",
   "cur": "TRY",
   "ind": "holding",
   "f": 86.7,
   "fk": 9.13,
   "pd": 0.43,
   "fdf": null,
   "peg": null,
   "nb": null,
   "mv": 181.9,
   "fg": null,
   "ng": null,
   "ngT": "zarardan kâra",
   "h": 170.48,
   "sma20": 90.27,
   "sma50": 89.98,
   "sma200": 94.15,
   "not": "Holding: geçen yıl aynı dönemde zarar, bu yıl kâr. Banka iştiraki konsolide olduğundan borç oranları dikkatle okunmalı.",
   "notAsOf": "2026-10-02"
  },
  {
   "k": "SASA",
   "ad": "Sasa Polyester",
   "market": "BIST",
   "cur": "TRY",
   "ind": "chemicals_textile",
   "f": 1.93,
   "fk": null,
   "pd": 0.47,
   "fdf": 19.76,
   "peg": -0.06,
   "nb": 11.33,
   "mv": 101.3,
   "fg": 115,
   "ng": null,
   "ngT": "kârdan zarara",
   "loss": true,
   "h": null,